Issue ID,Commit Link,Title
HBASE-19935,https://github.com/apache/hbase/commit/00e54aae24d88ac9c2b84db5ea1eaf11c3e5d73c,Only allow table replication for sync replication for now
HBASE-19505,https://github.com/apache/hbase/commit/018a65b947a7e78fb98a190d75787f50d42d0711,Disable ByteBufferPool by default at HM.
HBASE-18108,https://github.com/apache/hbase/commit/023d4f1ae8081da3cb9ff54e6b2e545799704ce7,Procedure WALs are archived but not cleaned; fixThe archived Procedure WALs are moved to <hbase_root>/oldWALs/masterProcedureWALsdirectory. 
HBASE-19492,https://github.com/apache/hbase/commit/03e79b79949a63f7320b4c51fecca40f93659bd9,Add EXCLUDE_NAMESPACE and EXCLUDE_TABLECFS support to replication peer config
HBASE-20159,https://github.com/apache/hbase/commit/061a31fad1654d9ded96d118e04c14860413fa25,Support using separate ZK quorums for client
HBASE-19919,https://github.com/apache/hbase/commit/06dec205826a6e96e2286180460e5fe014b46fc8,Tidying up logging
HBASE-21247,https://github.com/apache/hbase/commit/0789f544547505fd457a3a75cf66241dfe1243c0,Allow WAL Provider to be specified by configuration without explicit enum in Providers
HBASE-20469,https://github.com/apache/hbase/commit/092efb42749bf7fc6ad338c96aae8e7b9d3a2c74,Directory used for sidelining old recovered edits files should be made configurable
HBASE-18994,https://github.com/apache/hbase/commit/0acfba0e35933d1008c9ade721055dafc137b50f,Decide if META/System tables should use Compacting Memstore orDefault Memstore
HBASE-12091,https://github.com/apache/hbase/commit/0c4fbcc32973e9fb3840cb2b5e397155044c2b0c,Optionally ignore edits for dropped tables for replication.
HBASE-19672,https://github.com/apache/hbase/commit/0cd6050d090d11240a40c012716b3d747fbcb58f,Correct comments for default values of major compaction in SortedCompactionPolicy#getNextMajorCompactTime()
HBASE-21203,https://github.com/apache/hbase/commit/0e173d38b05363e1fb5c85955a4964f05958c1fc,HBASE-20734 Colocate recovered edits directory with hbase.wal.dir
HBASE-18533,https://github.com/apache/hbase/commit/0e32869f01697abf29292aa786d0cdcca10213c6,"Expose BucketCache values to be configuredBefore this commit, BucketCache always used the default values.This commit adds the ability to configure these values"
HBASE-18023,https://github.com/apache/hbase/commit/0e8e176ebd3bd17d969d17ce2b0aa3dafb93fa22,Log multi-* requests for more than threshold number of rows
HBASE-19630,https://github.com/apache/hbase/commit/1025388da6df8516fbbdf0dc21249660602f0b01,Add peer cluster key check when add new replication peer
HBASE-22001,https://github.com/apache/hbase/commit/10ca598004ae7db38945145b232a1c809e4ef6b1,Polish the Admin interface
HBASE-19394,https://github.com/apache/hbase/commit/11467ef11126c77b3692479730752ee38dff20a6,Support multi-homing env for the publication of RS status with multicast
HBASE-19144,https://github.com/apache/hbase/commit/125f3eace9b35e7947721bba5175ca5dc48921e8,[RSgroups] Retry assignments in FAILED_OPEN state when servers (re)join the cluster
HBASE-19621,https://github.com/apache/hbase/commit/1556939236016bb51e45ffa1e8038c74e0f0db75,Revisit the methods in ReplicationPeerConfigBuilder
HBASE-19647,https://github.com/apache/hbase/commit/16cd9169768351fcdb6876d499888bd1834cca97,Logging cleanups; emit regionname when RegionTooBusyException inside RetriesExhausted
HBASE-16894,https://github.com/apache/hbase/commit/16d483f9003ddee71404f37ce7694003d1a18ac4,"Create more than 1 split per region, generalize HBASE-12590"
HBASE-21871,https://github.com/apache/hbase/commit/177d43d8db8ee90273db1d7c317725f0792a4cd0,Added support to specify a peer table name in VerifyReplication tool
HBASE-19024,https://github.com/apache/hbase/commit/17ac2fe9c13d2b567c6bc06690e1491dfba83090,Provide a configurable param to hsync WAL edits to the disk for better durability
HBASE-16417,https://github.com/apache/hbase/commit/17e7aff37e6b69cae0fb6d15ebeb2037d1ca6acc,In-memory MemStore Policy for Flattening and Compactions
HBASE-19973,https://github.com/apache/hbase/commit/183b8d0581f82e56e928ca7153ab50558e57045d,Implement a procedure to replay sync replication wal for standby cluster
HBASE-18646,https://github.com/apache/hbase/commit/19bb4ef487407cdf59a3f3c5bbef6dd8b917b682,"LogRollMasterProcedureManager: make procedure timeout, thread pool size configurable"
HBASE-20856,https://github.com/apache/hbase/commit/1d0fca370bf56a41fc62b72bebe86a7185a2b0c2,PITA having to set WAL provider in two places
HBASE-20390,https://github.com/apache/hbase/commit/1eabbb42954b94308f85434ed2a9a80ba3e03c5e,IMC Default Parameters for 2.0.0
HBASE-19783,https://github.com/apache/hbase/commit/20ccaef8418a34b909256c2a0b68f55b390c9dfb,Change replication peer cluster key/endpoint from a not-null value to null is not allowed
HBASE-22186,https://github.com/apache/hbase/commit/20f72f5e252233361ee474e58b4a8fef69926b8b,Remove usage of deprecated SnapshotDescriptionUtils fields
HBASE-18309,https://github.com/apache/hbase/commit/2442cbb6ab5b9f1729b74361dd2bbb066d5910bd,Support multi threads in CleanerChore
HBASE-19747,https://github.com/apache/hbase/commit/274b813e1221c366e2c4773910d202b65298768f,Introduce a special WALProvider for synchronous replication
HBASE-21809,https://github.com/apache/hbase/commit/2776bc0151051c8d20d9b1c2ac6142ade6a31b62,Add retry thrift client for ThriftTable/Admin
HBASE-21588,https://github.com/apache/hbase/commit/281d6429e55149cc4c05430dcc1d1dc136d8b245,Procedure v2 wal splitting implementation
HBASE-18161,https://github.com/apache/hbase/commit/293cb87d52d6ccc98f0d03387f9dc07dc4522042,Incremental Load support for Multiple-Table HFileOutputFormat
HBASE-20879,https://github.com/apache/hbase/commit/2997b6d0714d5542784baf830e7c16a9ef6b62d6,Compacting memstore config should handle lower case
HBASE-19923,https://github.com/apache/hbase/commit/2b63af376edbca53eb0475e929478bd38b580aae,Reset peer state and config when refresh replication source failed
HBASE-19289,https://github.com/apache/hbase/commit/2c9ef8a471148ece655b881cc490b6b685d634f4,Add flag to disable stream capability enforcement
HBASE-19618,https://github.com/apache/hbase/commit/2ce5dc892710666c9a382fdeece412ecbb8559bb,Remove replicationQueuesClient.class/replicationQueues.class config and remove table based ReplicationQueuesClient/ReplicationQueues implementation
HBASE-22547,https://github.com/apache/hbase/commit/2e414360bd7aee15769eb46a00b2fa108b3bcbb5,Align the config keys and add document for offheap read in HBase Book.
HBASE-19602,https://github.com/apache/hbase/commit/2f255894223abb51b6f9d5c680e226b25c6d788a,Cleanup the usage of ReplicationAdmin from document
HBASE-19494,https://github.com/apache/hbase/commit/32f6fd41c274a955338b7c43ab80309b9adbba0d,Create simple WALKey filter that can be plugged in on the Replication SinkImplement new WALEntrySinkFilter (as opposed to WALEntryFilter) andspecify the implmentation (with a no-param constructor) in configusing property hbase.replication.sink.walentrysinkfilter
HBASE-18307,https://github.com/apache/hbase/commit/351703455a091171a1abc90f250f52f0a7a0aaab,"Share the same EventLoopGroup for NettyRpcServer, NettyRpcClient and AsyncFSWALProvider at RS side"
HBASE-22005,https://github.com/apache/hbase/commit/35b818606ffb4e67cf9acf3b55af4ea9e3ce8c32,Use ByteBuff's refcnt to track the life cycle of data block
HBASE-18137,https://github.com/apache/hbase/commit/384e308e9f2387422e76ceb1432d6b2b85a973cf,Replication gets stuck for empty WALs
HBASE-19957,https://github.com/apache/hbase/commit/39dd81a7c69763475e5a72f6c84e0f450fd957e5,General framework to transit sync replication state
HBASE-18224,https://github.com/apache/hbase/commit/3b444a066c0c699aff749713209950198f1b21e4,Upgrade Jetty
HBASE-20636,https://github.com/apache/hbase/commit/3de02d57f632d5c2cb2027cca3bd0333210f5619,Introduce two bloom filter type : ROWPREFIX and ROWPREFIX_DELIMITED
HBASE-16868,https://github.com/apache/hbase/commit/3e2941a49e58080618fd2d2e6757694c96651e0a,Add a replicate_all flag to avoid misuse the namespaces and table-cfs config of replication peer
HBASE-19128,https://github.com/apache/hbase/commit/4132314f51951af43f4f56d9886233b3ba417903,"Purge Distributed Log Replay from codebase, configurations, text; mark the feature as unsupported, broken."
HBASE-19619,https://github.com/apache/hbase/commit/41c2dd04da21bb76208f04af104df2e2f444970d,Modify replication_admin.rb to use ReplicationPeerConfigBuilder
HBASE-21536,https://github.com/apache/hbase/commit/420fbba6aefa58bb6ff252ff0c33e9b4ccae64b0,Fix completebulkload usage instructions
HBASE-19163,https://github.com/apache/hbase/commit/428e5672e77d6dea9cfdafb5a3052415b9926d12,Maximum lock count exceeded from region server's batch processing
HBASE-20569,https://github.com/apache/hbase/commit/44ca13fe07dc5050a2bc98ccd3f65953f06aaef8,NPE in RecoverStandbyProcedure.execute
HBASE-18846,https://github.com/apache/hbase/commit/456057ef90f152315a7f244141f3fca4ff748336,Accommodate the hbase-indexer/lily/SEP consumer deploy-typePatch to start a standalone RegionServer that register's itself andoptionally stands up Services.
HBASE-20401,https://github.com/apache/hbase/commit/4613f3e8c740e881505fcd2c661a0e28462eb459,Make MAX_WAIT and waitIfNotFinished in CleanerContext configurable
HBASE-18511,https://github.com/apache/hbase/commit/473446719b7b81b56216862bf2a94a576ff90f60,Default no regions on master
HBASE-22301,https://github.com/apache/hbase/commit/47b4ab7b9732b790b2b471c489f670093e64ad2c,Consider rolling the WAL if the HDFS write pipeline is slow
HBASE-18335,https://github.com/apache/hbase/commit/48d28c7a248d0f8c19b18c20d4484864ac67b549,configuration guide fixes
HBASE-19344,https://github.com/apache/hbase/commit/49a9fe48830cb0ef0ae9eef2de305420c08d09ab,improve asyncWAL by using Independent thread for netty #IO in FanOutOneBlockAsyncDFSOutput
HBASE-19295,https://github.com/apache/hbase/commit/4a2e8b852dceb8f68adf33c940621734cc6e2f12,"The Configuration returned by CPEnv should be read-only.Adds a ReadOnlyConfiguration that delegates gets but throws exceptionon sets/adds, etc."
HBASE-21031,https://github.com/apache/hbase/commit/4a52ddb75e2d18c6b044146b03bb1dba90ec4184,Memory leak if replay edits failed during region opening
HBASE-18090,https://github.com/apache/hbase/commit/4aadc5d322884310ce6ef49fb0031bfbd2a096b9,Improve TableSnapshotInputFormat to allow more multiple mappers per region
HBASE-22225,https://github.com/apache/hbase/commit/4b84ab32b372121f7fec50a4c7310b06e8a86ee0,Profiler tab on Master/RS UI not working w/o comprehensive message
HBASE-19158,https://github.com/apache/hbase/commit/4c203a9be038e8110737509439666f5af6e90c2c,First pass at a 1.2 -> 2.0 upgrade section.
HBASE-19148,https://github.com/apache/hbase/commit/4d6b928682cc2a17f3dfd0179fb3fd46fd9e0a1f,Reevaluate default values of configurationsRemoved unused: <name>hbase.fs.tmp.dir</name>Added hbase.master.loadbalance.bytableEdit of description text. Moved stuff around to put configs beside eachother.M hbase-server/src/main/java/org/apache/hadoop/hbase/util/ServerCommandLine.java Emit some hbase configs in log on startup
HBASE-19389,https://github.com/apache/hbase/commit/4f54a66782e1621437a4c8eeea59aec37efa08c4,Limit concurrency of put with dense (hundreds) columns to prevent write handler exhausted
HBASE-18083,https://github.com/apache/hbase/commit/4fe73857679ecba89a7edd3c17d9f92e4c0e2164,Make large/small file clean thread number configurable in HFileCleaner
HBASE-18452,https://github.com/apache/hbase/commit/51954359416b107ce5eda6cb710449edc98ab0e6,VerifyReplication by Snapshot should cache HDFS token before submit job for kerberos env
HBASE-21727,https://github.com/apache/hbase/commit/51c58e083ca89a33de79c8531a16f7072c488d6d,Simplify documentation around client timeout
HBASE-20295,https://github.com/apache/hbase/commit/53b4507c7949362d49a1b827f2cdf2b1e8cefa68,fix NullPointException in TableOutputFormat.checkOutputSpecs
HBASE-22053,https://github.com/apache/hbase/commit/53f449c47e49d0fb99bb659964babf1e352350b8,Changed zookeeper URL from http://hadoop.apache.org to https://zookeeper.apache.org Replaced version 3.1.1 with 3.3.3 as 3.1.1 is deprecated.
HBASE-18262,https://github.com/apache/hbase/commit/5507150a163f08c966f4cd55607feff8e2570c17,name of parameter quote need update
HBASE-22057,https://github.com/apache/hbase/commit/59406c44e3ac1c046d0c467d452fca80c848d93a,Impose upper-bound on size of ZK ops sent in a single multi()
HBASE-19486,https://github.com/apache/hbase/commit/5a1c36f70ac52e6f4e85f11ea0602d46b4861ac0,Periodically ensure records are not buffered too long by BufferedMutator
HBASE-21148,https://github.com/apache/hbase/commit/5a672b9da9b67376e3fc3b88fdf88dca3004a38f,[Docs] Some errors in section#Security Configuration Example of hbase book
HBASE-21098,https://github.com/apache/hbase/commit/5c1b325b510976fe2955593d95690ba507c32e03,Improve Snapshot Performance with Temporary Snapshot Directory when rootDir on S3
HBASE-21126,https://github.com/apache/hbase/commit/5cca61c4d0e7f1cf03fb7a80c7611bde4a49214b,Configurable number of allowed failures for ZooKeeper
HBASE-18023,https://github.com/apache/hbase/commit/5cd7f630c21c32b183ec23adcfcd16595d7e72a3,Update row threshold warning from 1k to 5k (addendum)
HBASE-21034,https://github.com/apache/hbase/commit/5ded2944199f27440a46df6f200ff2a31c1b8728,Add new throttle type: read/write capacity
HBASE-15482,https://github.com/apache/hbase/commit/5e7d16a3ceaeec5057474f9bae2d40d306f6dd8e,Provide an param to skip calculating block locations for SnapshotInputFormat
HBASE-17972,https://github.com/apache/hbase/commit/5ff04c5e7fdf12946a3f0ae15ed7e83209f0e617,Remove mergePool from CompactSplitThread
HBASE-20576,https://github.com/apache/hbase/commit/603110719d9d26705e782ba048db713b18cb076a,Check remote WAL directory when creating peer and transiting peer to A
HBASE-20273,https://github.com/apache/hbase/commit/621e2b5f5ee82871ffc344a53c1dc08442cd0cd8,Additional removed/changed configs
HBASE-19258,https://github.com/apache/hbase/commit/64ef12080899dad4ab60652a76c68fb59ded04f2,IntegrationTest for Backup and Restore
HBASE-19418,https://github.com/apache/hbase/commit/668a17988222e7657ff21f945b6dd023bda4276c,configurable range of delay in PeriodicMemstoreFlusher
HBASE-20193,https://github.com/apache/hbase/commit/66ad9fdef8e8bff3ed2b77cd8865f724b345bd18,Basic Replication Web UI
HBASE-18870,https://github.com/apache/hbase/commit/6712f8f632e6ece032ee45f679db9a42a69f805f,Hbase Backup should set the details to MR job name
HBASE-16060,https://github.com/apache/hbase/commit/67b69fb2c70d3a56ac45f59d57b7f2778094a566,1.x clients cannot access table state talking to 2.0 cluster
HBASE-21568,https://github.com/apache/hbase/commit/67d6d5084cf8fc094cda4bd3f091d8a0a9cb1d3e,Use CacheConfig.DISABLED where we don't expect to have blockcache running
HBASE-18329,https://github.com/apache/hbase/commit/68436c9bbaefa78704b30315713de94dd991fda1,updated links in config guide to point to java 8 references
HBASE-22292,https://github.com/apache/hbase/commit/6855143ba90ada2e731ff82dfcc5d250e1f8329a,PreemptiveFastFailInterceptor clean repeatedFailuresMap issue
HBASE-22598,https://github.com/apache/hbase/commit/686847cb79038d2fe91aee277f3827fbe5341b49,Deprecated the hbase.ipc.server.reservoir.initial.buffer.size & hbase.ipc.server.reservoir.initial.max for HBase2.x compatibility
HBASE-21926,https://github.com/apache/hbase/commit/6cd78e899fd37393eaa9f142facbee2d9a052dba,Profiler servlet
HBASE-17825,https://github.com/apache/hbase/commit/6cfa208add6ea424e17cae00114ebd3e7d7967f1,Backup further optimizations
HBASE-20499,https://github.com/apache/hbase/commit/6d080762ef795adf02dd0ab236c4b3eb73e19a91,Replication/Priority executors can use specific max queue length as default value instead of general maxQueueLength
HBASE-21000,https://github.com/apache/hbase/commit/6d08ffcfc6e646751b35b111389403329b121c89,Default limits for PressureAwareCompactionThroughputController are too low
HBASE-21639,https://github.com/apache/hbase/commit/6da0b4ec34727240e433825382cfc30366340097,maxHeapUsage value not read properly from config during EntryBuffers initialization
HBASE-15982,https://github.com/apache/hbase/commit/6e7baa07f0b1f5841379545acaf23d36f50de2c2,Interface ReplicationEndpoint extends Guava's Service
HBASE-21857,https://github.com/apache/hbase/commit/6f16836c20802ff50ed3b0ab4bc4f1bfa791465e,Do not need to check clusterKey if replicationEndpoint is provided when adding a peer
HBASE-21867,https://github.com/apache/hbase/commit/72df52283b6c1b60252f6d78ade32a23a59197d5,Support multi-threads in HFileArchiver
HBASE-21247,https://github.com/apache/hbase/commit/7395ffac447bdb159b5c9a2bc65f95af0eea11fe,Custom WAL Provider cannot be specified by configuration whose value is outside the enums in Providers
HBASE-19806,https://github.com/apache/hbase/commit/7573e07cc69d6da672512d6fb01926275dc27971,Lower max versions for table column family of hbase:meta
HBASE-18375,https://github.com/apache/hbase/commit/75a6b36849c58d6a751f57226ab0c8f7884a9e87,"Fix the bug where the pool chunks from ChunkCreator are deallocated and not returned to pool, because there is no reference to them"
HBASE-21159,https://github.com/apache/hbase/commit/77db1fae090bc20de62d8a86e9816c69dfb97b7a,Add shell command to switch throttle on or off
HBASE-21492,https://github.com/apache/hbase/commit/7877e09b6023c80e8bacd25fb8e0b9273ed7d258,CellCodec Written To WAL Before It's Verified
HBASE-18750,https://github.com/apache/hbase/commit/78d9b7ffad2760f1a31434b47b02bdc355b5aebf,"Cleanup the docs saying ""HTable use write buffer"""
HBASE-19722,https://github.com/apache/hbase/commit/78e7dd6537801534d02a8bff567e361759b7c5db,Meta query statistics metrics source
HBASE-20590,https://github.com/apache/hbase/commit/7da0015a3b58a28ccbae0b03ba7de9ce62b751e1,REST Java client is not able to negotiate with the server in the secure mode
HBASE-21792,https://github.com/apache/hbase/commit/7dc69b61287d66641f0ae3d251b1d106d2a00ccf,Mark HTableMultiplexer as deprecated and remove it in 3.0.0
HBASE-19483,https://github.com/apache/hbase/commit/7ddf79946da4bc8f0dfa673b48f29023e5ff5bcf,Add proper privilege check for rsgroup commands
HBASE-19524,https://github.com/apache/hbase/commit/7f4bd0d371e9faf59076468e5efe416045eb525a,Master side changes for moving peer modification from zk watcher to procedure
HBASE-21338,https://github.com/apache/hbase/commit/807736fcf153d0d83eab50fd20d096d37c651ca9,Warn if balancer is an ill-fit for cluster size
HBASE-20449,https://github.com/apache/hbase/commit/80cbc0d1fefdba1492d7ec6e580ad54a2960cbdb,The minimun number of region should be configurable
HBASE-19734,https://github.com/apache/hbase/commit/8118d5de4e842ff02e38b66643d07518ff48e38d,Fix IntegrationTestReplication and related impl changes
HBASE-21764,https://github.com/apache/hbase/commit/81ebe6d40d485a3aee4451acc340cf6db62609b7,Size of in-memory compaction thread pool should be configurable
HBASE-18478,https://github.com/apache/hbase/commit/8301734594011e7f94f992e6f8c815580a6b62d8,Allow users to remove RegionFinder from LoadBalancer calculations if no locality possible
HBASE-19285,https://github.com/apache/hbase/commit/835d15bf9779698bd0b269c2008a496be79090d2,"Implements table-level latency histogramsFor a egionserver's view of a table (the regionsthat belong to a table hosted on a regionserver),this change tracks the latencies of operations thataffect the regions for this table.Tracking at the per-table level avoids the memory bloatand performance impact that accompanied the previousper-region latency metrics while still providing importantdetails for operators to consume"
HBASE-18226,https://github.com/apache/hbase/commit/83be50c2ab01b428df3b0496215fda8d66ae1bd6,Disable reverse DNS lookup at HMaster and use the hostname provided by RegionServer
HBASE-21072,https://github.com/apache/hbase/commit/86b35b26870be3a04304a4483c08fcf7c50d55f5,Block out HBCK1 in hbase2Write the hbase-1.x hbck1 lock file to block out hbck1 instances writingstate to an hbase-2.x cluster (could do damage).Set hbase.write.hbck1.lock.file to 0 to disable this writing.
HBASE-21228,https://github.com/apache/hbase/commit/86cb8e48ad8aecf52bca1169a98607c76198c70b,mory leak since AbstractFSWAL caches Thread object and never clean later
HBASE-19890,https://github.com/apache/hbase/commit/87ab7e712df4b9c9b24665488a69190310e747d9,Canary usage should document hbase.canary.sink.class config
HBASE-18721,https://github.com/apache/hbase/commit/8a800c3f196fcbc3ed63f0967025c1779c43d486,Cleanup unused configs and private declaration
HBASE-18010,https://github.com/apache/hbase/commit/8ac4308411df0528a3ef5a3aae0297154940cd9d,Connect CellChunkMap to be used for flattening in CompactingMemStore
HBASE-19282,https://github.com/apache/hbase/commit/8d0da1a77f50b730b366c28b5b477141aa83cc55,Making CellChunkMap the default index
HBASE-18387,https://github.com/apache/hbase/commit/8da77b414657f0ee3b093913de5f92eba17ecd2a,"Thrift] Make principal configurable in DemoClient.javaAdded OPTIONal (fourth) parameter ""server-principal"""
HBASE-15560,https://github.com/apache/hbase/commit/8ec93ea193f6765fd2639ce851ef8cac7df3f555,W-TinyLFU based BlockCache
HBASE-18662,https://github.com/apache/hbase/commit/90c15bae8d5e2acb4d58977bdfbb3425f80466a2,The default values for many configuration items in the code are not consistent with hbase-default.xml
HBASE-19441,https://github.com/apache/hbase/commit/91075276e7638f64e3e213358edd37198f540e1b,Implement retry logic around starting exclusive backup operation
HBASE-19506,https://github.com/apache/hbase/commit/92d04d57516391376d34aaca6307e5906ffa4ae8,"The CellChunkMap index chunks are usually small, so in order to prevent memory underutilization, HBASE-19506 presents small chunks preallocated in a small pool"
HBASE-22193,https://github.com/apache/hbase/commit/942f8c45cd1a1e0a8956fc10b811dd2add510645,Add backoff when region failed open too many times
HBASE-22095,https://github.com/apache/hbase/commit/94c18f065365461a9cf9077a00cc72a4747980bd,Taking a snapshot fails in local mode
HBASE-6028,https://github.com/apache/hbase/commit/950d6e6fb0fdcf923aea66e17e617c06ecd5a628,Add switching on/off of compactions.
HBASE-20740,https://github.com/apache/hbase/commit/98245ca6e4b6b8cffe22534f32e825c912de2ed3,StochasticLoadBalancer should consider CoprocessorService request factor when computing cost
HBASE-22274,https://github.com/apache/hbase/commit/987d36879c310d567f3b0b0e04a91960f14f453f,Cell size limit check on append should consider cell's previous size.
HBASE-20050,https://github.com/apache/hbase/commit/99d3edfc82d89d6da23008f3ab0a203317cec6f2,Reimplement updateReplicationPositions logic in serial replication based on the newly introduced replication storage layer
HBASE-17513,https://github.com/apache/hbase/commit/9a45e0a9ded094d18bdcbbcaf4cf3944e7faf6d9,Thrift Server 1 uses different QOP settings than RPC and Thrift Server 2 and can easily be misconfigured so there is no encryption when the operator expects it.
HBASE-19841,https://github.com/apache/hbase/commit/9ea152d2351cfb2607a5a861358470969ce24548,LocalHTU to not enforce stream capabilities
HBASE-18808,https://github.com/apache/hbase/commit/9f0863ce5f25276e22ac0d3b2c03b4f6f2296578,Ineffective config check in BackupLogCleaner
HBASE-21816,https://github.com/apache/hbase/commit/a155d17fa6b0afab2c21d404af7ea92f195dcef0,Print source cluster replication config directory
HBASE-21277,https://github.com/apache/hbase/commit/a1f28f3ca77d1cd9777d694e246b57d642dfcdb8,HBASE-21277 Prevent to add same table to two sync replication peer's config
HBASE-8518,https://github.com/apache/hbase/commit/a21eb68f9584e69157fed683cc512ee3e8963dfb,Get rid of hbase.hstore.compaction.complete setting
HBASE-22244,https://github.com/apache/hbase/commit/a3d2a2df3a0837f39d586f5f2018fd630883fa10,Make use of MetricsConnection in async client
HBASE-21810,https://github.com/apache/hbase/commit/a54f0bfb8f9a0b7d6ec4e4585cd30b9e674bfde8,bulkload support set hfile compression on client
HBASE-19568,https://github.com/apache/hbase/commit/a5601c8eac6bfcac7d869574547f505d44e49065,Restore of HBase table using incremental backup doesn't restore rows from an earlier incremental backup
HBASE-19211,https://github.com/apache/hbase/commit/a5a38b79166d83db37491b2740711ee655ed9b63,B&R: update configuration string in BackupRestoreConstant
HBASE-18843,https://github.com/apache/hbase/commit/a6c9d371df6243458ef2db17bcfea9af890076b8,Add DistCp support to incremental backup with bulk loading
HBASE-21460,https://github.com/apache/hbase/commit/a8198759390984bb06701b40d1bbdfb90e251e14,correct Document Configurable Bucket Sizes in bucketCache
HBASE-19090,https://github.com/apache/hbase/commit/a899659b1601de831328a108b4c4ba031aa89f5a,Add config 'hbase.systemtables.compacting.memstore.type' tohbase-default.xml
HBASE-20466,https://github.com/apache/hbase/commit/a8be3bb814378805a1b5eae85826c9eff3768534,Consistently use override mechanism for exempt classes in CoprocessorClassloader
HBASE-20886,https://github.com/apache/hbase/commit/a8e184dc77470bdf9d62e19c5d36bc1de7cf4c6d,[Auth] Support keytab login in hbase client
HBASE-19416,https://github.com/apache/hbase/commit/aafaba448dc0a9f8f78f9ff7a12528721212e5d3,Document dynamic configurations currently supported
HBASE-22559,https://github.com/apache/hbase/commit/ab4453158a41e29bb75e219079584997be756cbe,[RPC] set guard against CALL_QUEUE_HANDLER_FACTOR_CONF_KEY
HBASE-19359,https://github.com/apache/hbase/commit/abb535eef661dc9cf0f72f18b96151ae7d5d0179,Revisit the default config of hbase client retries number
HBASE-20530,https://github.com/apache/hbase/commit/acbc3a225338fd1ff82226ebbd937f7b15ef5b60,Composition of backup directory containing namespace when restoring is different from the actual hfile location
